author_id,created_at,text
14701373,2025-08-12T11:42:16.589214+00:00,"The essence of Col Hunt's book is a wakeup call to the United States and to the world. He lays out an abbreviated history of terrorism related to the U.S.A., who the terrorists are, why they are a threat, and what should be done. While the"
14499554,2025-08-12T11:42:16.682103+00:00,God's Word is more powerful than any other. David Wilkerson has searched the Word and compiled in this little book (The Jesus Person Pocket Promise Book) 800 of God's promises to those who believe. They are categorized to speak to us in our
20595117,2025-08-12T11:42:16.769250+00:00,"Anna Freud the youngest child of the founder of psychoanalysis was her father's student, and intellectual heir. But she did not content herself with simply parroting her father's teachings she made pioneering investigations of her own in th"
14830770,2025-08-12T11:42:16.872777+00:00,"This collection of three one-act plays is a great choice for a low-budget, low-royalties Halloween production."
51701443,2025-08-12T11:42:16.965182+00:00,I liked Girl's character and I thought Buster was cute but Girl's workplace and boss(es) were like a bad dream where you realize you've forgotten to study for a final. It made me so happy (and relieved) a. to be 48 yrs old and b. to have ma
35992983,2025-08-12T11:42:17.050602+00:00,"From reading this book recently, I have to say that this shows in great detail on what was already known for decades, that Stalin ignored all warnings that Germany was going to invade the Soviet Union in June 1941. The good thing in this bo"
52005235,2025-08-12T11:42:17.150500+00:00,"My thanks to Peter Hobson for pointing out that I wrongly said \\""Juggernaut\\"" for \\""Dreadnought.\\"" As he rightly suspects, all reviews can be at risk for errors, including his own. The author of \\""Dreadnought\\"" is Robert (not Richard)"
51926785,2025-08-12T11:42:17.248718+00:00,"In a very easy-to-read book, Birla uses his vast experience in FedEx to outline how the philosophy of FedEx evolved and thrives on innovation. The vantage point enjoyed by the author certainly reflects in this \\""big picture\\"" viewpoint of"
25383925,2025-08-12T11:42:17.333545+00:00,"I have read that the person who wrote this story compared her story with that of Harry Potter. Not so! There's not even a mention of anything remotely like Harry and, in my opinion, not worthy of the comparison. But, that's just me and my o"
13379469,2025-08-12T11:42:17.442651+00:00,The Biology of Belief is the journey of a scientist into the realm of the spiritual.   It takes us beyond the typical dogma of the medical profession into the domain of new thought and holistic healing.   Dr. Lipton gives many scientific ex
14758725,2025-08-12T11:42:17.532740+00:00,These Berenstain Bears CDs are a real favorite of the grandkids.  They ask for it in the car and for bedtime while they are falling asleep.  They teach a lesson in an entertaining way.  It was well worth it!
53040372,2025-08-12T11:42:17.618932+00:00,Not many books can capture your imagination like the Mad Scientists books.  I read these back in the late 60s and still have my original copy. Its been reread dozens of times and by the way where is Mammoth Falls? The location was always el
51247650,2025-08-12T11:42:17.712515+00:00,"A friend and I were out shopping a few weeks ago and we both picked up Bob Dylan's \\""No Direction Home: The Soundtrack\\"" CD,  which is the 7th volume in Dylan's archival Bootleg Series, and also the soundtrack for Martin Scorsese's excell"
53029815,2025-08-12T11:42:17.802993+00:00,"If you love inventory, secret penmanship, erotic pop-ups, Marie Antoinette memorabilia and shrimps . . . then this is the book for you.<br /><br />Alllen Kurzweil has written an intriguing page-turner of a tome. Our hero, Alexander Short, r"
52831137,2025-08-12T11:42:17.895925+00:00,"What happened at the San Francisco Zen Center is a riveting tale: sex, corruption, and spiritual enlightenment. I imagine the actual truth of what went on will never be known as each person involved tries to cope with their past.  So I supp"
19612698,2025-08-12T11:42:18.035755+00:00,"Great read, unique and interesting perspective about the US military from a qualified expert."
14720400,2025-08-12T11:42:18.153465+00:00,"Rick Kupchella, author of Tell Me What We Did Today, is a TV news anchor and reporter in the Twin Cities. He's also a dad who wrote an important story to share with children about the everyday life of children. Warren Hanson is the illustra"
40239809,2025-08-12T11:42:18.251420+00:00,"This book really makes you realize how to cherish every moment you have with someone. Especially your husband. After reading this book, I wanted to give my husband a big hug. This book really made me think about how important it is to never"
12114039,2025-08-12T11:42:18.336632+00:00,"Another book of Richard Evans that took me to a higher ground.  I always \\""feel\\"" more with his books than any others.  He changes hearts."
46650162,2025-08-12T11:42:18.451524+00:00,I usually enjoy Mckenna's books but this was a real loser.  For 53 pages Kathy whined and cried about hurting because she was telling her family goodbye for the last time.  Not once did she worry about how they would feel if she went off an
50266356,2025-08-12T11:42:18.549821+00:00,"Olivia is awesome and one expects the sequels to \\""classics\\"" to be as good or better than the first, this one is!!!  I LOVE IT and you will too!"
51801247,2025-08-12T11:42:18.642157+00:00,"This is one of the best books I have read in the past 20 years. <br /> <br />In reality there are three books in one. <br /> <br />The sociological analysis of values in England at the times, the historical context of the French, Spanish an"
30900284,2025-08-12T11:42:18.747779+00:00,"I finished this book in only a couple of days and now have so much more respect for Brooke Shields. What this poor woman went through trying to conceive, the horrible miscarriage, the loss of her father, emergency c-section that almost cost"
49355567,2025-08-12T11:42:18.843911+00:00,"I bought this book, thinking that it would offer some insight into Amazon.com in terms of what it was like to work there during its halcyon days.  Touted as a funny memoir, among other things, I was to discover that it was none of what was"
41791099,2025-08-12T11:42:18.928148+00:00,"A terrific book that teaches how to motivate and lead movement activities with elderly people and why movement is so important.  Her conversational style conveys technical and theoretical information in a relaxed, yet thorough manner.  Enjo"
52004203,2025-08-12T11:42:19.018681+00:00,"A tired and oddly romanticized yoke has been linking creativity and illness for a long time, particularly in those cases where the illness is a form of insanity and the creative person who's afflicted is a \\""genius\\""--or, more precisely i"
50915818,2025-08-12T11:42:19.106431+00:00,Anyone seeking to familiarize themselves with the basics pertaining to search and the search industry should read this book. It provides solid information not only on Google but the other major players in the search engine wars. <br /> <br
12116569,2025-08-12T11:42:19.193761+00:00,"I had to pile high a whole bunch of mob books for a project, and this one was at the very top. Now it is at the bottom and is going back tomorrow. Total \\""dreck.\\"" <br /> <br />When you compare this with all the classic mob books out ther"
52951470,2025-08-12T11:42:19.280793+00:00,"with her ability to write about characters from all walks of life with truth and compassion. In The Pull of the Moon, she has written of Nan, a woman of 50 who is having a mid-life crisis. Her body is changing in the way that makes all wome"
31143122,2025-08-12T11:42:19.365801+00:00,"This Greek text is the same as the 27th edition of the Novum Testamentum Graece, but with a more detailed apparatus, which is necessary for regular translators of the text. The text is large and clear, and the apparatus is neat and clean -"
16121903,2025-08-12T11:42:19.451280+00:00,"This is weird, but good..They weren't all a short time in convents like other reviewer says..They look hippie now some of 'em...(.Healthy photos.. ) Look better..(and Happier!...) than when they were nuns... I like the revealing of Catholic"
43798039,2025-08-12T11:42:19.547877+00:00,"This book has everything that you need to know to pass the PMP exam. It is organized by knowledge area and covers all process groups in adequate depth. Also, this version of the book for the third edition PMPBOK is a significantly improved"
12772505,2025-08-12T11:42:19.643182+00:00,This has got to be the best books ever. IN Eragon he dicovers Saphire and to add to there being a drogon in the story they make her smart and giver her a sense of humor. In Eldest they introduce they elves and heal all injuries and discover
52469391,2025-08-12T11:42:19.728109+00:00,"I'm so sick of business books that have \\""THE ANSWER\\"" for everything, which usually turns out to be just the same old stuff.  <br /> <br />This book points out that \\""one-size-fits-all\\"" advice ignores the fact that we all come to our"
15416830,2025-08-12T11:42:19.815852+00:00,"Under Dr. Dobbins' leadership, EMERGE Ministries is among the leaders in the integration of faith and counseling. Dr. Dobbins' ministry calling is \\""To bind up the broken hearted\\""-bringing the good news of the gospel to the hurting. His"
44660863,2025-08-12T11:42:19.900392+00:00,No you could not make a movie on the life of Pound.  This book is far more interesting.  It does not go into his early life enough nor does it explain his relationships with his parents very much.  It is interesting to read that Pound had a
25699443,2025-08-12T11:42:19.988488+00:00,Mr. Frey writes a typical and trite addiction/recovery book.  Unfortunately his immature view of his own strength and Chinese philosophy may lead some troubled person to try what has worked (so far) for Mr. Frey instead of the methodologies
12858253,2025-08-12T11:42:20.077563+00:00,I have just completed I Love the Illision: The Life and Career of Agnes Moorehead. I found the book to be quite informative. I never knew Ms. Moorehead was married twice. Nor did I know she had a sister who passed away many years before her
30856195,2025-08-12T11:42:20.162733+00:00,I found this book for sale through Amazon on (...)I bought it as a gift for a family member and she said it was the best health book she owns. I've seen this author on TV also and he is outstanding in his knowledge. This is a must have book
17743664,2025-08-12T11:42:20.252769+00:00,This is the third time we are reading this book...in a row!  My 8 year-old devoured it; I couldn't put it down; now my 6 year old is reading a chapter or two aloud to my 5 year old each time we drive in the car. <br /> <br />Bulla does a tr
20161340,2025-08-12T11:42:20.360681+00:00,"A very well written, and readable book.  The author does a good job of fleshing out the context in each time period of SK's life.  The reader comes to know the people who were important to SK both personally and professionally.  And, SK's i"
52902466,2025-08-12T11:42:20.447036+00:00,"\\""Born-and-raised\\"" Hobokenites who leave this little city pine away until they return. Hoboken has the best homemade mozzarella in the USA. Its politics are wild, its citizens creative and passionate. New Yorkers ferried here by the thou"
16980873,2025-08-12T11:42:20.539452+00:00,"\\""Why Do Catholics Do That?\\"" is a rare find- highly readable, unpretentious, and rock-solid in its information. I suspect that Johnson is an excellent teacher, for that is the style in which he writes. His chapters are focused on the bro"
50819479,2025-08-12T11:42:20.624364+00:00,"I have to admit, it took some will power for me to read yet another book about Dracula.  And when I'd finished it, I knew why.  For one thing, the Dracula in this novel just isn't as big a personality as I'd hoped he'd be when he finally ap"
12632612,2025-08-12T11:42:20.715097+00:00,"Computer Forensics is very appropriate considering a number of data storage facilities that <br />have been recently hacked into, resulting in theft of customer data. The subject matter of computer forsenic <br />is logically presented from"
38057363,2025-08-12T11:42:20.802612+00:00,"It's great that clicker training has finally gone to the birds!  Clicker training, indeed any training with positive reinforcement techniques, is rewarding for both you and your bird.  This book is a great place to get started with training"
12742489,2025-08-12T11:42:20.887230+00:00,Anyone seeking to familiarize themselves with african folklore or get a gist of the community setting must definately read this book. If not for the educational benefit just read it for fun. I had an indepth analysis of the topics and theme
24235088,2025-08-12T11:42:20.976282+00:00,"Good life lessons from a Buddist Nun. Soothing and Helpful, people for all walks of life can certainly benefit from listening to this retreat.  I have not ever been disappointed by listening to Pema Chodron."
12125714,2025-08-12T11:42:21.064706+00:00,"DEAN OF UMPIRES:BILL McGOWAN is a wonderful book. Bob Luke has the balls and strikes of a bygone \\""Big Leagues\\"" vividly flowing off the pages.We learn of a fascinating character umpiring during a more innocent era. You don't have to be a"
49641327,2025-08-12T11:42:21.150140+00:00,"no binding, typed out pages, real cheap, and i'm not going to rent a cruise ship to try to make money for me and my band...BUT hey some books are a real drag to read, this sucker i just breeeze through and i'm picking up LOT's of pointers a"
50122160,2025-08-12T11:42:21.251201+00:00,El Hughes comes from a southern cooking tradition where flavor is paramount. Then her husband was diagnosed with diabetes and heart problems necessitating a radical change of cooking strategies and mealtime menus. The need was for nutritiou
41903591,2025-08-12T11:42:21.335325+00:00,"I read this book for a master's class.  At first it was hard to get into, but the material slowly dawned on me.  By the time I finished the book, I can honestly say that it completely altered the way I write lesson plans.  By using the back"
50619555,2025-08-12T11:42:21.441039+00:00,"Better with each turn of the page.  Words to Feast on!!!  It stretches you mind and soul, encourages you and grows you in your Christian thinking."
52995115,2025-08-12T11:42:21.530907+00:00,"For those who want to become acquainted with the deepest mysteries of mind and their relationship to behavior, not only sexual, this book is indispensable."
12124402,2025-08-12T11:42:21.616271+00:00,A while ago Mr. King claimed to be ready to retire. I was sort of distressed as his books have brought me a great deal of pleasure through much of my life. I have taught Eng. classes for years with many of his books and consider him the mod
24434348,2025-08-12T11:42:21.700262+00:00,Many authors have written on the fall of France in 1940 but Keisling is the first to actually examine how French military structure and policy played perhaps the most significant role in the defeat. A one year conscript army and a totally u
31410879,2025-08-12T11:42:21.785308+00:00,"Beautifully written. You'll \\""flow\\"" from page to page. Your feelings will range from introspective to \\""Uh huh, I hear you\\"". I felt like putting my hands on my hips and reading it out loud. Wonderful reading to get you through the dai"
25460878,2025-08-12T11:42:21.874988+00:00,"This is a very good deck, I use it quite often. Although, the art work, in my opinion, could be much better. I recomend this deck to all. The art work is suitibal for young children. This deck is worth every penny! Over all this is a wonder"
51409121,2025-08-12T11:42:21.960217+00:00,"ISBN 8425216931 ONLY is an exclusively black & white, concise and copiously illustrated paperback survey of 70 major works on 224 pages published in 1997 by Gustavo Gili (GG) in the Works and Projects series in English and Spanish side by s"
53074803,2025-08-12T11:42:22.044147+00:00,"Incendiary is in the form of a lengthy letter to Osama Bin Laden by the woman whose son and husband were recently killed in a major terrorist attack.  This sort of set-up often comes across as a bit forced or clumsy, and it does here as wel"
32244924,2025-08-12T11:42:22.129144+00:00,La prsentation par David Downie de son livre  l'Alliance Franaise de Berkeley a t un grand succs. Tous les livres qu'il avait apports (trente) se sont vendus. Nous en aurions vendus plus.  <br /> <br />C'est un des rares auteurs amr
52607759,2025-08-12T11:42:22.221737+00:00,"A fascinating book.  I checked this book out at the library, transfered in from a Salt Lake City library.  I used it when I was writing a report and compared it with the latest version of The Book Of Mormon.  Through comparison, I was able"
41758147,2025-08-12T11:42:22.313913+00:00,This book should be the basis for all further research in the area of music therapy. I have sincerely never read a better work than this one on music therapy. Excellent theoretical background information and well-explained.
12122509,2025-08-12T11:42:22.408238+00:00,I thought that the book was good but it was very slow to read. I never really got one hundred percent into it. I would find myself thinking about alot of other things while I was reading. Once I even had to backtrack almost fifty pages beca
12122437,2025-08-12T11:42:22.492560+00:00,"How do I describe this book without giving it away? Let me try: A simple man, a commoner, a hard worker doesn't have much in life, nor does he ask much from life. His days are always the same, working at the amusement park, fixing rides and"
52773078,2025-08-12T11:42:22.579768+00:00,"the value of this text will ultimately be a function of one's mathematics background as well as the degree of familiarity with audio. personally, i found the book to be an excellent \\""update\\"" to the previous text..!! keep in mind that th"
42372377,2025-08-12T11:42:22.664509+00:00,"This is a must have book, not only for giving you options on how to save money, but for understanding what you are paying for."
36722167,2025-08-12T11:42:22.750166+00:00,I think it is a great reference source for AP Psychology.
50231796,2025-08-12T11:42:22.860822+00:00,"I recommend this series to any highly sensitive, spiritual people who work in the fields of therapy, teaching, or bodywork.  Her work is very grounded in the five elements, thus the incorporation of three separate cosmologies.  Highly effec"
12135832,2025-08-12T11:42:22.954067+00:00,Another great book by Reynard. The 3rd in the series continues the history and techniques of codes and ciphers. From George Washington to the Civil War to current day Russian spies. The programs are great. I must mention that the included b
52868156,2025-08-12T11:42:23.044250+00:00,"Sasha Solomon needs to start her PR consulting business back up sine she's just been fired from her current job.  Fortunately, she has one possibility already lined up.  The city of Clovis wants to increase their tourism revenue and is look"
13076311,2025-08-12T11:42:23.129321+00:00,"The Merchant of Death is the 1st book in the epic series of the adventures of Bobby Pendragon. Bobby is a normal, fourteen year-old kid, who was taken against his will by his uncle to become a *Traveler*. Now, this book starts off when Bobb"
37110924,2025-08-12T11:42:23.216856+00:00,"I'm not a salesman, but I read this book several times and expect to continue to do so.  Herein lies great advice for living.  Jack and Garry Kinder along with Roger Staubach present effective stratagies for succeeding in life.  Yep, there'"
12327169,2025-08-12T11:42:23.302906+00:00,I am a Pamunkey Indian and I wish to commend Ms. Graham for her research and correct use of the Tribe in her book.  This is the ONLY book I have ever seen that uses the Tribe name and the history of our people.  We are the forgotten tribe.
13378288,2025-08-12T11:42:23.393553+00:00,"\\""The Little Match Girl\\"" by Hans Christen Andersen was the first book I read as a child that affected me profoundly. I was able to make a personal connection to the text because I too was a young girl who was impoverished at the time. I"
32000484,2025-08-12T11:42:23.479605+00:00,"Thorough, witty, and well-written - this guide book covers all you need to know to get around L.A. and enjoy the best museums and restaurants the city has to offer. The premise of the book is it is a guide to museums and what you can do in"
51964117,2025-08-12T11:42:23.639877+00:00,That's not something I say about a lot of books.  in fact there are maybe ten that I have actually read more than once because I loved it.   <br /> <br />I actually emailed Aaron Krach to tell him how much I enjoyed his book.  it was just g
30773027,2025-08-12T11:42:23.747544+00:00,A must read for anyone that believes in the sacredness of nature and life. Tom Brown is truly one-of-a-kind.
14314354,2025-08-12T11:42:23.835711+00:00,"Anyone starting out in undergrad Political science should read this textbook, articles deal with current issues and can provide for lively discussion."
12126640,2025-08-12T11:42:23.924461+00:00,"The nerve of this mindless, ignorant blowhard is so rivolting that I've pitched this rag of a book for good.  Who, on earth, does he think is?  I'll tell you.  He was the genesis of today's arrogant, jock-sniffing sports journalist who take"
12319545,2025-08-12T11:42:24.013236+00:00,"The book that I recived came in perfect condition, a lot better than I thought it was going too. This was my fisrt purchase off of amazon, and I hope for many more like this one."
12416031,2025-08-12T11:42:24.105351+00:00,It is so refreshing to have someone in the media accurately talk about issues that are importmant to the American people.
51673242,2025-08-12T11:42:24.202843+00:00,"Unlike Herbert/Anderson's previous \\""Dune\\"" trilogy, this time around the second book is not only as good as the first, it's quite a bit better.  Sadly, the main problem from \\""the Butlerian Jihad\\"" is held over: Herbert/Anderson BADLY"
49772978,2025-08-12T11:42:24.310537+00:00,"Elantris passed my \\""couldn't put it down\\"" test. I totally lost myself in Sanderson's wonderful fantasy world of Arelon, Teo, and Fjordell. I really cared about the characters, and I was fascinated by the converging plot lines. I especia"
16580917,2025-08-12T11:42:24.395514+00:00,I am reading this book for a comparative essay I have to write for school.  So far it is pretty interesting.
51681418,2025-08-12T11:42:24.484160+00:00,"If you just study 1/2 hr or less a day, the structure of this primer will teach you the Greek alphabet, its phonics, and provide an imaginary cultural framework in which to practice. <br /> <br />Coupled with a more in-depth text, including"
35985708,2025-08-12T11:42:24.577110+00:00,"Ghosts are human souls which have not moved on but continue to stay in their favorite places as earthbound spirits.  On the othre hand, sorcerers and witches are considered to be devil's instruments.  Green-faced witches wiht warty noses ri"
12125562,2025-08-12T11:42:24.661081+00:00,I love this book!  I feel as if I really know this man now...I was very surprised by how well written it is.  This one is a keeper!  I would recommend this book in a heartbeat.  Bravo!!!
23708619,2025-08-12T11:42:24.747398+00:00,"have just finished (as in read the last page) of Esther Derby's and Johanna Rothman's book \\""Behind Closed Doors\\"".   Your gut reaction is wrong on this one.  It is not another how to be a manager in 30 days or less book,  <br /> <br />"
37075246,2025-08-12T11:42:24.844258+00:00,This insight into the diaries from the Lewis & Clark Explorations of the West is well written and gives a good look at the hardships and dangers the pioneers of this country faced.
41076517,2025-08-12T11:42:24.930573+00:00,"I never thought a story about a gorilla would interest me, but this book was quite entertaining and thought provoking.  Highly recommended."
12331766,2025-08-12T11:42:25.017430+00:00,"I have read all three of the books in this trilogy by Gingrich and Forstchen (Gettysburg, Grant Comes East and Never Call Retreat) and they bring the absolute horror of the American Civil War into perspective. Does America still have men of"
14644305,2025-08-12T11:42:25.103244+00:00,"very good , i have passed this book around my book club and everyone enjoyed it. but i still say addicted was her best."
51292568,2025-08-12T11:42:25.192668+00:00,"In this installment of Woods' Stone Barrington series, our hero is hired to track down his client's niece and separate her from  a less than acceptable boyfriend .... in London. That's about the only new twist here and that's where the hi-j"
49956276,2025-08-12T11:42:25.282307+00:00,"I believe that Charlene Schurch's book, \\""Sensational Knitted Socks,\\"" should be on everyone's shortlist of \\""must have\\"" instructional sock books! <br /> <br />The book is clearly written and provides an overview of sock basics, constr"
17689735,2025-08-12T11:42:25.368385+00:00,I have been a scout master and not a very good one. I was not a high achiever in Scouting.  After being called to serve as a bishop I got this book and read it.  I wish I had read the book long ago.  It is a great help.  I recommend it espe
37490665,2025-08-12T11:42:25.454920+00:00,I found this book to be indispensable on several trips to New York. It is much better than the DK version. I recommend this edition for its conciseness.
