author_id,created_at,text
14264412,2025-08-12T11:42:25.551762+00:00,"This book reminds me of the books written around 1992, which stated that the U.S. needs an \\""industrial policy\\"" like that of Japan and Germany. Of course, the reality was that those highly government-steered economies faced 10 years of d"
12534364,2025-08-12T11:42:25.640523+00:00,"Have you ever wondered: <br /> <br />1.  Why no one ever goes to a philosopher for advice? <br />2.  Why one mother had this to say about her son the philosopher: \\""He's the kind of doctor who can't help anyone.\\""? <br /> <br />If you're"
35004134,2025-08-12T11:42:25.737621+00:00,"-- for print-makers and print-lovers alike.<br /><br />This book covers every aspect of printmaking, from preparing a plate for grounding to preparing it for storage after the edition has been printed. It discusses the many kinds of etching"
12590868,2025-08-12T11:42:25.850116+00:00,"I found this book to be more focused on the bathing process and not much at all on cuts. Its filled with too much common sence information. Alot of words, not much useful info. Out of all my materials on grooming, this has been the one I ju"
12122284,2025-08-12T11:42:25.937262+00:00,"I stayed up over a 24 hour period because I couldn't put this book down.  If you've read Sista Souljah's \\""The Coldest Winter\\""...well this book is 10 times more exciting!"
45870112,2025-08-12T11:42:26.030229+00:00,"I've taught preschool Sunday school for six years now, and this curriculum is absolutely the best for kids.  I haven't used _Faith-Building With Preschoolers_ but imagine that it is just as good as this book.  Rather than trying to make kid"
45540226,2025-08-12T11:42:26.129628+00:00,"Until the last two books came out, this was my favorite!!!  The focus on Dursley's was amusing.  This is a good plot set-up for the others that followed.  When going somewhere overnight, this is the tape (also have tapes of books) I take to"
21537197,2025-08-12T11:42:26.215711+00:00,"Top Ten is perhaps one of the greatest graphic novels ever written.  It takes place in the fascinating world of Neopolis, a city populated entirely by people with extraordinary superpowers.  The characters are the police force that keeps th"
52440881,2025-08-12T11:42:26.318389+00:00,"this book is very controversial and expect to get slack-jawed looks from your friends if you agree with the author's premise and suggestions. as a father of 3, i completely agree with it. our lives are too nuts to take our kids to every sin"
51089052,2025-08-12T11:42:26.408475+00:00,"I really, really wanted to like this book, no, love this book, with its great reviews, middle eastern topical-ness, and tie in to literature. I set aside a weekend to devour it. But my God, did I find myself in deep dislike with the author"
29007308,2025-08-12T11:42:26.549091+00:00,"I like the Hannah Swensen Mysteries, always waiting for the next one out."
12134476,2025-08-12T11:42:26.633324+00:00,"I remember bringing my book back into the bedroom (of which i shared, at the time, with 13 other people) and reading the book, everyone would just stare at me as i laughed and giggled my way through the whole book!! From the first page, Kin"
46028009,2025-08-12T11:42:26.719660+00:00,"I've bought this book 4 times.  Each time someone comes over they end up taking it with them!  I was born in Cuba and can make almost anything from sushi to apple tartin, but I can't make the Cuban food my mother makes... this book gets me"
48794904,2025-08-12T11:42:26.808158+00:00,"This is Rice's strongest book so far, but the plot is too convoluted, which results in the book running too long by about eighty pages. Some of the characters could have been developed better(I found myself going back pages in order to bett"
23904427,2025-08-12T11:42:26.898262+00:00,"This book, for all its cutsie appeal, is nothing less than a message of hateful indoctrination to our children, born of greed from some of the wealthiest 1%, who want to create a new generation of working class Americans, who will blindly v"
12770833,2025-08-12T11:42:27.240515+00:00,"My daughter loves this book, especially when I read it with her name as the main character.  It's a perfect length for a toddler - and it helps introduce the concept of toilet training."
52849498,2025-08-12T11:42:27.339504+00:00,"Abraham Lincoln is revered by lawyers everywhere for his courtroom skills and practical wisdom. The Lincoln Michael Connelly refers is not Abraham, but rather the automobile.<br /><br />Mickey Haller, son of an original Los Angeles supersta"
39653614,2025-08-12T11:42:27.425508+00:00,"The protagonist of this novel is Clayton McKinley ,once a US Marshall who when we first encounter him is an escaped convict ,and one presumed to have died in the escape attempt .He was set up on a charge of armed robbery by a corrupt judge"
18519098,2025-08-12T11:42:27.512317+00:00,"A thoughtful, carefully presented analysis of the well crafted language of conservatives. The author briefly gets full of himself in a couple places -- he's earned the right to be lifted before the crowd, he should let others do it. Purchas"
35536089,2025-08-12T11:42:27.598418+00:00,"For a long time I have been looking for a book with a coherent and convincing analysis on successful self-regulation.  Well, perhaps any type of successful regulation.  Books on regulatory failure are much easier to come by.   And this book"
12126587,2025-08-12T11:42:27.688288+00:00,This paperback version is better because there is a better picture of me [no arm blocking my face ]+ my friend is on this cover. We will be doing a book signing world tour as soon as [BOB] sends us our advances.- Those countries not support
48965985,2025-08-12T11:42:27.786941+00:00,This book has some great insights into the frauds put out to the public.  It also gives the reasons why trusted people would deliberatey deceive the public.
32840849,2025-08-12T11:42:27.873487+00:00,Walk the land with the Israelites.  This is a very good book and I would like more like it.
14242930,2025-08-12T11:42:27.964433+00:00,"The easy flow of Abby's sunny sarcasm, her smoothing of the satiric-edge trademark of Magdelana Yoder gave me a cozier live in, in Tamar Meyers's DEN OF ANTIQUITY series than I experienced in the Pen Dutch literary gourmet style, though bot"
53093124,2025-08-12T11:42:28.053316+00:00,"On the second floor of the Scuola di San Rocco, Tintoretto's painting of the Temptation of Christ affords English academic Daniel Forster a glimpse of reality Venetian style.  The painting's focal point is not Christ, but the devil.  The de"
24871696,2025-08-12T11:42:28.138950+00:00,"I bought this book as an inexpensive, handy artists' reference on cats. I'm very happy with it. The book's title, front cover designs, and back cover description do a good job of telling you what to expect. It definitely answers my need for"
12181658,2025-08-12T11:42:28.224988+00:00,"That has never been one of my strong points. But it seems to suddenly hit DJ hard with her grandmother's marriage and her mother with a boyfriend, the good thing coming out of this all is that DJ will finally own her own horse. Through DJ's"
47528419,2025-08-12T11:42:28.346570+00:00,Tis book is well written in a unique style. It was a grat piece of escapism. I couldn't wait to get to the next chapter in the adventure as the author proceeded around he world. Having been a sailor I've always deamed of long distance trips
30617648,2025-08-12T11:42:28.448747+00:00,"Buy the book, it is a must read for all Christians. To get more information, you can review her Text/Video/MP3 on the SpiritLessons ,Com website.<br /><br />The testimony of Choo Thomas is true. I have seen it touch many lives, your can rea"
46788651,2025-08-12T11:42:28.549511+00:00,"I can not recommend this book enough.  It was wildly entertaining - often funny, sometimes sad, at times even suspenseful.  I did not enjoy the last Bill Bryson book I read (The Lost Continent - Travels in Small Town America) so it was a re"
52999693,2025-08-12T11:42:28.635691+00:00,At last a comprehensive view of what a total security program needs to be.  So much of the literature on the subject is about technology only that this wholistic approach is a breath of fresh air.  It is clearly and simply written and provi
21616947,2025-08-12T11:42:28.720245+00:00,"This book is outstanding with it's beautiful full color pages and great ideas. You will not be disappointed with this purchase. Love it! <br />Scottsdale, AZ"
36751540,2025-08-12T11:42:28.805447+00:00,Worthless is the keyword here. About as clear as mud. I purchased ACS primarily for use on a website. This book could not even get me past the opening screen of the GoLive program--I had to go to a non-dummy book (Adobe Creative Suite Bible
47516840,2025-08-12T11:42:28.891569+00:00,"This is my first Zadie Smith read, one of my book club picks. It's very different from the books I usually enjoy, but I found myself drawn into the story. If it had a better ending I would have rated it a five star. All in all, however. it"
12122513,2025-08-12T11:42:29.408369+00:00,This is a good book and shows the real character of John Kerry. The piece by The Boston Globe against John Kerry was particularly interesting. I was also impressed at how well researched this book is. So many references.  <br /> <br />The b
20595117,2025-08-12T11:42:29.494386+00:00,"I learned the Massekhet Sanhedrin both at home by myself, and in a regular Shiur with the Steinsaltz Talmud ( in Hebrew). It not only provided understanding of difficult suggiot which I could not possibly figure out by myself, it provided H"
51755007,2025-08-12T11:42:29.617815+00:00,"In WINTER KILLS, Richard Condon probes one of the most significant events in America's 20th century: the assassination of a president. Timothy Kegan is shot in a Philadelphia motorcade; a presidential commission condemns a lone psychopath a"
12123239,2025-08-12T11:42:29.737808+00:00,"When Someone You Love Has Cancer  <br />If someone you love has cancer, you probably feel sad, angry, and confused. It's OK to feel this way. Cancer is a serious disease. Your loved one is sick. He or she will need to see the doctor a lot."
12418158,2025-08-12T11:42:29.822393+00:00,This is one of the best books I have ever read. My friends teased me because I took it every where and wouldnt put it down. It is the kind of story that makes you want to luugh one minute and cry the next. You feel the hurt the pain and the
41129683,2025-08-12T11:42:30.047373+00:00,"I found this story line to be interesting - a woman starting over after the death of her beloved husband.  While there are some great analogies in the book, overall it is a huge disappointment!   It is hard to believe that relationships fro"
12122435,2025-08-12T11:42:30.134251+00:00,"Learning JAVA can be a very steep learning curve at first, but this book takes a great approach to making it as easy and painless as possbile, mainly due to the Authors genius."
46671774,2025-08-12T11:42:30.238252+00:00,"I have bought dozens of bread books recently and most are ok.  This book, however, is excellent.  I love the fact that it has forumulas for the breads scaled for the professional baker down to the home baker's 2 to 3 loaf size.  It also inc"
52290233,2025-08-12T11:42:30.326549+00:00,It is a very handy reference even for a small wedding.  Gave a lot of great ideas for the wedding and reception.  The wedding etiquite advice included in this book was also very helpful!
35771631,2025-08-12T11:42:30.429716+00:00,THE SHIVA OPTION conludes the story begun in IN DEATH GROUND. The story and the options are just as horrific and the consequences are just as bad.  <br /> <br />Humanity and its allies face a war to the end with a race that will either eat
14744270,2025-08-12T11:42:30.521365+00:00,"A wonderful,  rustic  setting,  the   related stories  about the given  recipes  were  interesting  as  to local  color,  anecdotes,  and  life.   This  was  a  gift  from  thoughtful friend,  and  I  bought  her  one in return.   I  collec"
14569545,2025-08-12T11:42:30.607020+00:00,I liked this book. It gives you a lot of new angles on very sensitive topics. What I particularly like is that Levitt steps outside the normal wisdom and shows us that the cause of problems might not be what we think. The thing that I miss
31570555,2025-08-12T11:42:30.692286+00:00,"In 1951,Senator Joseph R. McCarthy made a lengthy speech(constantly interrupted)in the Senate,highly critical of the military and diplomatic career of General George C. Marshall(and other \\""public servants\\"")during the Roosevelt and Truma"
52891975,2025-08-12T11:42:30.781625+00:00,"When I told my friends that I was reading a book about loving my belly, they all snorted. It seems that no one like, much less loves, their bellies. The Woman's Belly Book is more about honoring your creative power center. Using breathing t"
37533526,2025-08-12T11:42:30.875870+00:00,Germany had long and coldly calculated the requirements for hegemony over Europe culminating in the Schlieffen plan. <br /> <br />The infirmity of the Ottoman's led Serbia to successfully assert independence much to the chagrin of Austria w
31038971,2025-08-12T11:42:30.978141+00:00,"Life doesn't perfect a person, it unravels a person.  The thought that a point of \\""arrival\\"" is achieved is a myth.  The inner and outer conflict of the human journey doesn't work together to create evolutionary leaps, but a seeming digr"
51343128,2025-08-12T11:42:31.062810+00:00,"I would only recommend this book to a hard core Tolkien fan. A great source of information on the development of LOTR, but can be a bit tedious to get through."
52446309,2025-08-12T11:42:31.147753+00:00,My son (age 6) and I have had fun on Saturday mornings working through some of these activities. The activities have been both educational and easy to do. The instructions are easy to follow. Some of the activities are too simple and we did
38897938,2025-08-12T11:42:31.232961+00:00,"One of McCarthy's hilarious travelogues about the world and the places he's been. In this tale, McCarthy searches for his history and namesakes spread far across the globe. He is specifically going after the supposed head of the McCarthy cl"
12127507,2025-08-12T11:42:31.317793+00:00,"This book is truly great literature. The likeable young heroine, Laurel, leads the three musketeers through exciting action and adventure. When I read Dumas' book, I liked the musketeers. After reading \\""For Honor,\\"" I love them. The auth"
14535908,2025-08-12T11:42:31.404054+00:00,The book was just ok.. I wish I had seen it in a book store first... I might not have purchased it.I enjoy the frame games in the week-end news paper inserts and was a little dispointed.I didn't like the odd shape of the book or the way it
16230056,2025-08-12T11:42:31.508513+00:00,Very well organized!  Columns helped differentiate what was going on historically from what the Presidents did in office as well as what they did before becoming Presidents.  In the back you will find an index with the actual votes from the
25920483,2025-08-12T11:42:31.593172+00:00,"This book delivers way more than one would expect. First of all it is not that long of a book.  But it takes a long time to read because you cannot breeze through it.  Written by a South African pastor in the 1800's, this book has a woodenn"
52966360,2025-08-12T11:42:31.678783+00:00,"I purchased BLOG with the hope that I would learn more about blogging, something I know very little about.  While Hewitt is an enthusiastic cheerleader for blogging, he provides very little practical or detailed information about blogging."
50171370,2025-08-12T11:42:31.794377+00:00,"In the spring of 1945, with the war winding down in Europe, Nick Leonidas is one of the thousands of GIs who have become deserters, hiding out in Brussels and Paris. Dodging the seemingly ever-present MPs, trying to survive by selling stole"
32214344,2025-08-12T11:42:31.883017+00:00,"I've read all of Kinky Friedman and loved each, some better than others, but all were good. <br /> <br />I have only one \\""Cat Who ...\\"" book left, but each of those has been a gem. <br /> <br />Marjorie Allingham and Dorothy L. Sayers ar"
12325673,2025-08-12T11:42:31.975514+00:00,"This book is an excelent introduction to robotics and to electricity basics; but I recomend if the user has knoledge of electronic read stiquito avanced experiments, it will be much interesting for the user."
51096197,2025-08-12T11:42:32.060737+00:00,"\\"" Human slavery is wrong, insecure, and demoralising. On mechanical slavery, on the slavery of the machine, the future of the world depends.\\"" That profound quote from Oscar Wilde leading off the robot section tells you that this is not"
51212051,2025-08-12T11:42:32.146422+00:00,More drama! Man talk about a soap opera! I think I like this sequel better because SOMEBODY finally stood up to Brice. Loose Ends is a very compelling and engaging read. I finished this one in one day too.
25328888,2025-08-12T11:42:32.240763+00:00,"Larry Gonick continues to out-do himself with every new book he comes out with.  This book is both intricate and funny, with amazing attention to details.  Each page teaches and amuses, very typical of his work.  You will learn more about s"
12332393,2025-08-12T11:42:32.365953+00:00,"This study has been amazing!  Distributors can't keep these books on the shelves and Amazon has been a great help.  I predict it becomes the next \\""Purpose Driven Life.\\"""
12332921,2025-08-12T11:42:32.450433+00:00,It does not give technical hints but just a detailed and photographic description of different BMW Bike Models.
52245047,2025-08-12T11:42:32.536460+00:00,I've been to Charleston and Kiawah Island once this year (2005) and only wish I had this book then. Will bring it with me when I go back to that area in 2006. It gives just the right amount of information on the things a visitor needs to kn
50122160,2025-08-12T11:42:32.621475+00:00,"You have to have been a fan of the science fiction TV series Farscape, from England, to appreciate Joe Nazarro's fine Creatures Of Farscape; Inside Jim Henson's Creature Shop. With that prerequisite met, prepare for an outstanding survey wh"
52163026,2025-08-12T11:42:32.705626+00:00,"Great Book and tremendous material for a great movie without a lot of gore. A must read for military and government people. Having a military background with the Naval Security Group and the National Security Agency, I thoroughly enjoyed re"
38438188,2025-08-12T11:42:32.793933+00:00,"Joanna's Challenge was a very fun read. Complex emotions, strong secondary characters that further the plot, a well developed storyline, and outstanding dialogue, which added another level to the sexual tension in this book. There are so ma"
12371247,2025-08-12T11:42:32.878559+00:00,"How our sense of smell works; exactly what is an essential oil (some are not oils at all); how to blend oils for aroma, beauty, and health ---ALL these are covered in this easy to read resourse.  <br />A wealth of information for beginners"
51153459,2025-08-12T11:42:32.963489+00:00,This is one of the most wonderful books on chocolate that I have ever read and cooked with.  I had the opportunity to visit Recchiuti Confections when I was in San Francisco this spring and was thrilled when I saw this book -- Michael Recch
52764204,2025-08-12T11:42:33.052887+00:00,"Brian Murphy has given us a reverential yet factual account of his journey through the tradition, construction, and marketing of Oriental rugs. His descriptions of the Afgan countryside are heartbreaking, but the converstions with those in"
26877558,2025-08-12T11:42:33.137562+00:00,"Kenneth Patchen is a one of a kind poet.  He wrote two or three poems worth all the musty little university poetry journals put together.  His sincerity is brutally sweet when he's sweet, and brutally cruel when he's angry.  Every word shiv"
49543118,2025-08-12T11:42:33.303186+00:00,"A friend of mine recommended this book because of the cool artwork, but there's also an excellent spooky story too!  I'm looking forward to the rest of the series.  Go Zombienose!"
50307712,2025-08-12T11:42:33.398763+00:00,"Before art instructors of the late 20th and early 21st century Betty Edwards or Mona Brookes shared their insights with us, Harold Speed wrote this profoundly analytical handbook explaining the psychological and technical foundations of dra"
52816088,2025-08-12T11:42:33.484759+00:00,It is an inspiring introduction to early christian thought. Wilken shows how the early church interacted with early Hellenized thought.     These early theologians created a new world of thought that they used to seek the face of God. The a
49210446,2025-08-12T11:42:33.608299+00:00,"While not approaching the magnitude of A Passage to India, or even Howard's End, A Room with a View offers an entertaining enough, if not rare, look at the middle class British (traveler's) life. Consumed with the self-discipline and propri"
32471525,2025-08-12T11:42:33.694209+00:00,"I have been trying to pick up knitting for quite awhile, but I was always put off by the confusing language of patterns.  This book lays everything out in simple, easy-to-follow directions with pictures and little hints that prevent you fro"
35771631,2025-08-12T11:42:33.778201+00:00,"It seems like the skinks are back and the men of the 34th will have to face them again so they ship out ready to rock and roll. Things are not, however, as they seem. If I said any more, I'd be giving away vitals so I won't. There is, howev"
52477965,2025-08-12T11:42:33.864150+00:00,"The individual investor has no better friend than Jack Bogle.  Not only did he introduce index funds as a significant investment alternative some thirty years ago, but he has consistently and uncompromingly spoken out against the shareholde"
41694040,2025-08-12T11:42:33.958765+00:00,"Finally, a Kennedy memoir I can sink my teeth into.  What I enjoyed most about this book is its human aspects and its honesty.  Mr. Lawford does not write from the viewpoint of victim.  He takes responsibility for his life and how he has li"
24198579,2025-08-12T11:42:34.049353+00:00,"In all of my 12 years in ministry and my own journey for Wholeness in Christ, very few people have been able to simplify and illuminate the process of healing from what I hate to call \\""common\\"" or \\""typical\\"" sexual brokenness in our c"
29671818,2025-08-12T11:42:34.135812+00:00,"Barbara Freethy bit off more than this reader can swallow. Writing a dumbed down version of \\""Russia House,\\"" \\""Parent Trap,\\"" and Anastasia, the author actually has a great plot and story idea, but she didn't research, didn't build up"
52435095,2025-08-12T11:42:34.221579+00:00,"I found this self-published book through a review in Earthlight Magazine. While I am no longer a kid, I do have 12 grandchildren and keep looking for resources that will help them understand our universe. After getting a positive response f"
38506485,2025-08-12T11:42:34.306251+00:00,"Nothing particularly new here.  Bottom line:  If you're forty and not running your own company, then you're vulverable as hell in corporate America.  The author writes well enough, but her worldview is academic, not corporate, so much of ap"
12806920,2025-08-12T11:42:34.396550+00:00,A delightful and informative book. An easy read.  Reminded me of Lucien gregore's A God for Lions. It is in that class.
49317781,2025-08-12T11:42:34.491464+00:00,This book has helped me more than a very expensive pelvic floor workshop I attended which just taught me how to become tense. These are the best fourteen bucks I have spent in exercise literature. The book has to be slowly digested and pace
27686629,2025-08-12T11:42:34.576375+00:00,We re using the yellow book in class and it is not as good or helpful as this book. I use this book along with the required text and this is far better. Our teacher agrees although he prefers the other book because in answer section it give
52294791,2025-08-12T11:42:34.664356+00:00,"This book suffers from two problems.  One is that it throws readers directly into conversation and overwhelms them.  I used the book to pick up a few cultural niceties, but my Chinese friends laughed at my failure to use the correct tones."
26300978,2025-08-12T11:42:34.749197+00:00,"This book is absolutely amazing, not to mention the fact that the author is incredible. She speaks straight from her heart, and captures the mind of a teenager."
51803143,2025-08-12T11:42:34.837749+00:00,"K. M. Soehnlein begins this his second novel with the narrator Jamie Garner returning from San Francisco to his boyhood home of Greenlawn, New Jersey for the funeral of his father with whom he has not spoken nor visited for the past few yea"
25434833,2025-08-12T11:42:34.923618+00:00,"I've only read good reviews of this book, and was excited to buy it. Once we received it, I knew my 4 year old boy (who is admittedly a \\""sensitive soul\\"") wouldn't like it. Throughout the book, he just felt sad for the bird who desparate"
24281508,2025-08-12T11:42:35.009442+00:00,My experience with microsoft publisher was limited at best. This little pamphlet was perfect for me. It had everything I needed to know to get our club's newsletter up and running within a few days.
52884128,2025-08-12T11:42:35.096099+00:00,"This book is has many designs devoted to fine gauge knitting, from fingering to DK.  The designs are classic and there are well crafted close-ups of details for each sweater.  It's a pleasure to see a book with fine gauge yarns for adult wo"
