author_id,created_at,text
16267484,2025-08-12T11:41:44.112738+00:00,"This was amazing.  It flawlessly told the origin of the Batman.  The retro style artwork lent perfectly to the book. The only problem is that they \\""introduce\\"" joker at the end of the book, and completly leave out the red hood."
52656223,2025-08-12T11:41:44.556630+00:00,This is a first rate history of the U.S. Navy in the first two decades of the Cold War.  It was supposed to be the first of a series of books on the subject but the author died before any of the later books were written.  It is already a st
41704330,2025-08-12T11:41:46.298469+00:00,I just discovered Fawn Germer's books thanks to a friend who saw her speak in D.C. last year.  What great advice for someone who is struggling career-wise.  I am in a situation where I am unwilling to compromise my beliefs in order to fit i
20918956,2025-08-12T11:41:46.965254+00:00,"Not really straying from the average calendar, the OTH calendar is the usual 12 month calendar with corresponding season 2 promo shot. Each main cast member has 1 month dedicated to a solo shot (Chad, Sophia, James, Hilarie & Bethany) with"
51290644,2025-08-12T11:41:48.407984+00:00,I hoped that this guide would have more background on the history of the city and its attractions.  The background/history portion of the guide was extremely sparse.  I have not read any of the other popular guides to Shanghai so I cannot m
50005452,2025-08-12T11:41:48.586744+00:00,This is a modern day retelling of the classic story Never cry wolf.  This is told with dogs as the main characters.  These dog apply for the job of sheep protectors!  They all do a great job.  One day one of the dogs gets bored.  He decides
33376665,2025-08-12T11:41:48.802796+00:00,"This was a perfect read at the beach novel. It's too short for any character development.  It has romance, anger, deceit, a crime, a hospital scene and sex. A well written story and a real page turner."
25455027,2025-08-12T11:41:49.711882+00:00,This was a well done and beautifully photographed book. I constantly look back into this book for help and info on my own dog. I even found some of her relatives in it.
42207039,2025-08-12T11:41:50.114397+00:00,"ISBN 0307020398 - First, since the book description is missing (as of the moment I'm writing) - Winnie the Pooh visits Rabbit for lunch, eating so much he is unable to get out the door. While stuck there, he meets Gopher, who proposes to di"
52672557,2025-08-12T11:41:53.921338+00:00,As a PSIA Ski Instructor I would recommend folks be very careful about some of the canting information in this book. The book assumes that all bowlegged skiers are overcanted and while this is mostly true it is not absolutely true.  Many bo
50210127,2025-08-12T11:41:54.601189+00:00,"The book is a sensation in the literary world and is a best seller. While the truth of the the matter is, the book is simply boring . <br /> <br />You have to commend the author for a clear depiction of the life in Iran during the Iran - Ir"
12115648,2025-08-12T11:41:55.310608+00:00,Like the overwhelming majority of people who have read this book I was blown away by the power of the writing and the strength of the characters and am delighted to hear the book will very shortly be back in print with Llumina Stars.  The p
12152552,2025-08-12T11:41:56.671713+00:00,"I am so grateful that Gilad Elbom decided to write his first novel in English. I can't imagine reading this book in translation (but if English is not your first language, I'm sure the translations still stay true to form). Gilad's ability"
12311399,2025-08-12T11:41:56.891777+00:00,"Tough to start but extremely funny. Looking forward to more from Ms. Soloway, what a talent."
42211153,2025-08-12T11:41:57.223382+00:00,I loved this book and would read it to my younger children with no problems at all.  The story line really appeals to children with a sense of humour (my five year old will love it!)  The theme of where's my Daddy is familiar to them from a
52324205,2025-08-12T11:41:57.666798+00:00,"This book is an excellent \\""manuscript\\"". It displays incredibly fluid and detailed pencil illustrations with a vivid commentary about the existence of dragons and unicorns. Beautiful - a must-have for anyone who likes mystical creatures!"
17148286,2025-08-12T11:41:58.877733+00:00,"\\""Bait and Switch\\"" is very much in line with \\""Nickel and Dimed\\"": the author takes on Nellie Bly journalism in the working world and makes a series of observations and solutions. <br /> <br />Perhaps it was the lack of camraderie, but"
14991569,2025-08-12T11:41:59.821668+00:00,"i saw this on reading rainbow when james earl jones narrated it. its my favorite story from the series because it shows how everything is connected, coming together to perform one action. it also inspired me to do cartoon based on how the p"
