author_id,created_at,text
40715763,2025-08-12T11:49:26.480294+00:00,"Soft Matter Physics is an excellent compilation of chapters on different aspects of soft matter, written by the experts in their respective areas. In more ways than one, this text complements the texts of Chaikin & Lubensky as well as the o"
38091985,2025-08-12T11:49:26.564917+00:00,"This book challenged my mind set and point of view.  While I didn't agree with every jot and tittle, it was eye opening. Overall I agreed with what Lisa Bazler had to say.  The case that she makes is a strong one. It is very true that psych"
51619856,2025-08-12T11:49:26.649012+00:00,"This book is great.  It's incredibly accessible, short and to the point.  I notice that a lot of people think he's glib, but I quite enjoyed his dry humor and laughed out loud a few times.  I even read sections of his book to several people"
48937549,2025-08-12T11:49:26.736168+00:00,"I can still remember reading 20,000 LEAGUES UNDER THE SEA for the first time as a kid.  I was fascinated by submarines and captivated by the story of this wonderful ship, capable of making all my dreams come true.  I wanted to dive beneath"
50991725,2025-08-12T11:49:26.820875+00:00,Recently met the author and what a nice man/author.  It was a complete pleasure to talk about the series and the upcoming books. I have had this series on my shelves for awhile and just got around to reading them all back to back.  That is
12476858,2025-08-12T11:49:26.905225+00:00,"Beware of blank pages.  The copy I got has blank pages 167, 171, 177, 185.  This is very sloppy quality control at the printer's shop.<br /><br />Image quality is what should set this book apart.  Sadly, the illustrations are not high-quali"
51190156,2025-08-12T11:49:26.990327+00:00,"This Interlinear Bible is presented very nicely.  Includes Greek text with Strong's numbers for easy reference, direct English translation under the Greek, Green's English translation on one side, and the King James Version to the other sid"
12121702,2025-08-12T11:49:27.074917+00:00,"I found this algebra/trig. book to be very satisfactory, with only a few things I'd change about it.  The word problems found in the last section of each chapter offer the right level of difficulty, interesting situations, and the character"
52576692,2025-08-12T11:49:27.159406+00:00,"This is the fourth Harry Bosch book that I've read and it is by far the most personal.  This time, Detective Bosch investigates the one crime that drove him to join the police force: the unsolved murder, in 1961, of his own mother.<br /><br"
50743236,2025-08-12T11:49:27.245796+00:00,"Nathalie Dupree is an adoptive Southerner -- she was born in New Jersey. Now there's nothing wrong with that; we welcome everyone down here, but she is not Southern and she is decidedly not \\""country folk.\\"" Anyone with a certificate from"
25828171,2025-08-12T11:49:27.330296+00:00,"Hey there.  Just a quick note to all the haters and doubters out there.  Don't judge before you have experienced.  When I first encountered Sylvia Browne in the late 1990's, I used to think exactly as some of the reviewers of her books and"
27822336,2025-08-12T11:49:27.415124+00:00,"This is by far the best text I have found.  Although it is considered a text book, it is more handy as a reference tool. I have seen no other book that contains more information than March's.  This book is actually worth the price."
12751337,2025-08-12T11:49:27.499995+00:00,"This important new book is both a grim warning about the road we humans are hurtling recklessly down and an inspiring message of hope about how special people called \\""Sparks\\"" are rising to the challenge.<br /><br />The author invites us"
50797603,2025-08-12T11:49:27.584055+00:00,"This is a terrific book for someone who wants to learn to weave. It starts off with a very brief introduction to looms and ancillary tools needed by the weaver.  It then provides a very detailed discussion, complete with many pictures, of h"
49880048,2025-08-12T11:49:27.707458+00:00,"Update: This book is now no longer being revised annually.  However, the tax code doesn't change that much from year to year, so the book can still be worth reviewing,  especially for its strategic financial advice and citations of rulings."
41905526,2025-08-12T11:49:27.882835+00:00,"A family on vacation encounters a cold-blooded gang, a gullible and naive housewife is struck by a mysterious (but hilariously common) \\""illness,\\"" a 104-year-old Civil War veteran is a featured guest at his 62-year-old daughter's high sc"
35985708,2025-08-12T11:49:27.968519+00:00,"For thirty years now, a new kind of astronomy called \\""state of gravitational wave\\"" has been taking place as we get ready to \\""listen\\"" to what is out there.  Gravitational waves are \\""ripples in space time.\\""  These infinte waves wh"
51010391,2025-08-12T11:49:28.054784+00:00,"Small Island is a fascinating collection of personalities trapped by their own assumptions, often clashing with the reality of the world they live in. Hortense Roberts, a Jamaican, marries Gilbert Joseph, also Jamaican, trained in America t"
44495527,2025-08-12T11:49:28.140285+00:00,"This is the best book I have read on transactional analysis. It is straightforward, includes only what you really need to know and not all the good-to-know background research, and is full of examples that you immediately click with. I read"
25638620,2025-08-12T11:49:28.238149+00:00,get the book it help me to play the game & win
12787478,2025-08-12T11:49:28.352376+00:00,"My son's theatre department is putting on this play.  My son tried out for a part.  He made the first cut, got all excited and wanted the play.  However, he did not make the second cut.   I believe he is returning the book.  Thanks so much"
25421702,2025-08-12T11:49:28.437986+00:00,Plenty of information and plenty to learn if you approach it with an open mind!
23956913,2025-08-12T11:49:28.525790+00:00,"Like him or not, the man is a brilliant person with some <br />excellent ideas..."
52808418,2025-08-12T11:49:28.637977+00:00,"Like Elvis paintings on black velvet, I don't question the artist's skill so much as I question the genre. Susskind's writing skills often dizzy the mind with his stunning talent. The olfactory word is suddenly clear and colorful, sweet and"
37303178,2025-08-12T11:49:28.743013+00:00,"This is just the sort of book to read for that 20 minute ride on the subway each morning. The plot is moderately entertaining and there is some vivid, if at times bland and cliched, imagery.  <br />That being said, this book breaks no new g"
48717027,2025-08-12T11:49:28.831804+00:00,"This book tells very little about making armor. It is a collection of shots of a harness as it is made. The pictures are of little use without some explanations. It is like seeing pictures of someone driving a car, looks good but really doe"
44788486,2025-08-12T11:49:28.925095+00:00,"The last decades of the 20th century saw an increasing number of books and articles about Rabbi Judah Loew of Prague (also called the \\""Maharal\\""). More and more people consider the Maharal (died in 1609), who was chief rabbi of Prague, M"
13368541,2025-08-12T11:49:29.081624+00:00,"this book is so amazing!! it seems that it's filled with great history, leading me to the mountaineering world. i love it!!"
12122756,2025-08-12T11:49:29.181678+00:00,"First, I would like to say that \\""The Complete Idiots Guide to Being Sexy\\"" is much better than The Complete Idiots Guide to the Arts of Seduction. Get this Being Sexy book over that Art of Seduction book for sure. \\""The Complete Idiots"
12959126,2025-08-12T11:49:29.298953+00:00,This book is a sweet way for a grandmother to share memories with her grandchild. I bought this for my mom when we had our first child and she loved it!
51958323,2025-08-12T11:49:29.430719+00:00,"\\""Kudos to Judy\\""...A \\""steller job\\""??? Of what? Typing up OTHER people's creativity and getting paid for it? I gave no permission, nor did any friend I've asked, to be reproduced in any of her books. I'm lucky, Judy hasn't seen me for"
52054593,2025-08-12T11:49:29.521589+00:00,"Geneva Settle, a Harlem born African-American high school, is doing research for a school paper in a library when she is attacked by a white man who apparently intends to rape her. Geneva manages to get away from him via a fire escape and r"
23552160,2025-08-12T11:49:29.634747+00:00,This is the best book I ever read dealing with a disability. I am the caregiver of my disabled wife and son and this gave me an insight of some of their inner most feelings. I would recommend this to anyone dealing with a disability.
42453189,2025-08-12T11:49:29.723753+00:00,"With the medium of poetry, Reid Baer is able to tell the story of  the old and new wounds that are a part of a man's journey.  This is not poetry that requires you to have a vast knowledge of ancient texts in order to understand his intenti"
50824192,2025-08-12T11:49:29.808576+00:00,"A companion to the Book of Revelation, ESCAPE THE COMING NIGHT, takes much of the guess-work out of interpreting one of the most difficult books in the Bible. His easy-reading, yet didactic, writing style makes David Jeremiah one of today's"
44163284,2025-08-12T11:49:29.896962+00:00,"I used this book as a quick refresher years ago and loved it so much that I later took a class from the author.  He happened to be teaching at my university, and the book had really clicked with me.  I'd detested math my whole life, but thi"
25616515,2025-08-12T11:49:30.027244+00:00,"I thought the poems were good, very inspiring and interesting.  I would encourage anyone who love empowerment as well a thirst for knowledge to read this."
16840425,2025-08-12T11:49:30.126328+00:00,"I am a huge Kevin Smith fan!  I have seen all the films multiple times.  The commentary tracks and the documentary materials are often as funny as the movies themselves, as Smith riffs on his cast and his own skills as writer and director."
12182132,2025-08-12T11:49:30.214074+00:00,"I ordered this study guide thinking it could supplement the other guide I was reading for Human growth and development CLEP exam. What I got was a spiral bound collection of barely 21 pages in all. There were no question papers, no indepth"
12208491,2025-08-12T11:49:30.299959+00:00,"I read this a few years back, but I still remember it well for being the first book I couldn't bring myself to finish. I read about 100 pages, which took me over a month, after which I sat down and pondered whether the plot or characters ac"
48363269,2025-08-12T11:49:30.384282+00:00,"I just recieved this bible KWM266 and the Goatskin leather is very nice and soft, the paper in this bible is top Quality, the Printing of the text is first class I was afraid the 8 point text would be to small and I was correct it is, I can"
36324250,2025-08-12T11:49:30.469419+00:00,"This book comes with two pages of mistake corrections, and that's only the mistakes they found. I've found some that aren't on the list. This is a book that's suppose to be teaching me stuff I don't know but I don't really know if what I'm"
26843784,2025-08-12T11:49:30.554872+00:00,"Teery brooks is a genius, this book that end the heritage series is an explendid book, it conlcudes everything that happened in the first 3 books of the heritage series and it leaves you with your mouth open wishing for more."
50881246,2025-08-12T11:49:30.640274+00:00,"Jonathan Safran Foer takes literary risks and entertaining leaps in his debut novel, \\""Everything is Illuminated,\\"" an amusing chunk of magical realism. It's a tragicomic experience, centering on the devastation of the Holocaust, and a mo"
12320809,2025-08-12T11:49:30.725292+00:00,"Oh, it was delightful. Though, I am a bit preturbed that I was not consulted for possible material. I found the remarks about the fat man splendid. Long story short, regarding the book:  Please sir, may I have some more? <br /> <br />rprebe"
52770663,2025-08-12T11:49:30.810420+00:00,"This book is for real. It doesn't talk down to you or make unreal promises. It just provides the facts, and you can understand them. <br /> <br />Raw IS the only way to shoot, you might as well know what you are doing, and how to do it bett"
22844788,2025-08-12T11:49:30.895937+00:00,"This book was far beyond what I expected. It is filled with photos, lots of instruction, the images are beautiful.  Zbukvic very definitely does capture atmosphere.  In his demonstrations, he'll often tackle a subject from three different p"
50914842,2025-08-12T11:49:30.980581+00:00,"When the local sheriff is a suspect in the murder of your mother - and the best friend/adopted son of your other two suspects - don't expect his enthusiastic cooperation. Expect insults, sexual innuendos - and an appallingly inconvenient de"
45175899,2025-08-12T11:49:31.071314+00:00,Excellent book. Well written and inspirational. A read for all people.
30074089,2025-08-12T11:49:31.161241+00:00,"Niven and Pournelle have written some really fine books.  A Mote In God's Eye and Inferno are especial favourites of mine.  This book was just not of the same calibre, and to top it off, they blew up my home town!  <br /> My family has live"
49245583,2025-08-12T11:49:31.246824+00:00,"Even though Stephen King has written a million and a half books, I have never read any of his works. Then I met a fellow fantasy buff who told me I was a worthless peon unless I picked up the Dark Tower series. And so, I gave it a chance an"
45284807,2025-08-12T11:49:31.333556+00:00,If you're looking for a suspense filled historical novel with more twists and turns then you can shake a stick at; as well as historically set against a backdrop of a medieval castle with secret corridors and peepholes; and for that edge of
48579090,2025-08-12T11:49:31.418271+00:00,"I needed the 10th edition and that was the advertised picture on the website. My classmates had the 10th edition so I knew what it looked like, when it arrived it was nothing like the picture, the book is a 8th ed. I thought it would be oka"
12929966,2025-08-12T11:49:31.503146+00:00,"If it were posible, i believe this book should be required for anyone wanting to birth a new church in the US.  As McLaren delivered the narrative in his, \\""A New Kind of Christian\\"" Dan delivers the practical in the Emerging Church...I a"
42159447,2025-08-12T11:49:31.587887+00:00,Books are of little value in planning a bachelor party. I read this book and had to laugh. For a suggestion that is a no brainer (if you are in the tri-state area) check out [...] I read someone elses posting took their advice and had my bu
51142749,2025-08-12T11:49:31.671911+00:00,"Life Together is Bonhoeffer's description of community life at the Finkenwalde seminary, the underground seminary for the Confessing Church that he led until it was closed by the Nazis.  Life Together provides a practical conclusion to Bonh"
51644901,2025-08-12T11:49:31.756633+00:00,"not a bad book if you are just starting out, they go through Items needed to a couple projects as well, worth the money."
50733952,2025-08-12T11:49:31.842035+00:00,This is a hilarious story about the everyday happenings of a British 14-year-old. I listened to it as an audiobook-- the British slang and wonderful narration would be worth the listen even without the entertaining story. The references to
52921118,2025-08-12T11:49:31.926712+00:00,"John Harris is not shy about his feelings for DSotM.  The back cover of this book states \\""Pink Floyd's 'Dark Side of the Moon' (1973) is one of the most beloved albums of all time.  A sonically stunning exploration into dark themes...  Be"
12774264,2025-08-12T11:49:32.012926+00:00,Get this book and apply everything it says and score 4 or higher on IB English. It especially helps with the oral and written commentaries. Highly recommended for those who wish to do well in English.
28055754,2025-08-12T11:49:32.097928+00:00,"The only problem with this book was that I couldn't put it down!  It is well written, and revealed many secrets of the Mormon faith to me.  There are some hilarious parts, as well as some deeply spiritual thoughts that Martha Beck shares wi"
27531762,2025-08-12T11:49:32.182020+00:00,"The Illusion of Life is one of the two books that every single person who wants to animate should own, the other being the Animator's Survival Kit.  Written by two of the most influential men in the world of animation, this book goes over e"
14057930,2025-08-12T11:49:32.266241+00:00,"The illustrations are beautiful and the story short and sweet; it would make a good bedtime story. My daughter loves hearing it at the bookstore over and over. It also has a good lesson about how humans impact the environment around them, i"
48760448,2025-08-12T11:49:32.351093+00:00,"I started reading this book four weeks ago and have improved my photography skills considerably, regarding what settings to use, how best to work with wide angle lenses, whether I'm hiking in the woods or eating at a restaurant.  I'm just a"
39569598,2025-08-12T11:49:32.434957+00:00,"Chretien de Troyes is an early French romantic writing, who wrote the first known story about the Holy Grail. De Troyes lived in the Champagne region of France during the latter twelfth century. Peripherally attached to courts including tha"
52903617,2025-08-12T11:49:32.520357+00:00,"This book is rare among computer books in that it has both solid technical content and appealing design. This is not an all-in-one reference, more of a learn-by-doing guide with lots of supporting information. The book is well organized, an"
45166085,2025-08-12T11:49:32.610507+00:00,"As a general history intended for the academic market, Bonds's contribution ranks as a formidable contender with K Stolba's and Grout/Palisca's works. Visually appealing with many period paintings, illustrations and tables in color, the boo"
19493437,2025-08-12T11:49:32.694970+00:00,"This was the first  Suzanne Enoch book I read and frankly it's my last. Her main character, Lady Eleanor is a spoiled brat and has few redeeming qualities. Valentine, the hero, was unlikable and didn't fair any better in my opinion by the e"
12806920,2025-08-12T11:49:32.788947+00:00,"A very good detailed account of how a Pope is elected, surpassed probably only by that of Lucien gregoire' Murder in the Vatican."
43547330,2025-08-12T11:49:32.873568+00:00,"I'm currently using this book in my Honors English Course and I have to say the story is flawless, a perfect additon. The story is defenitely not for the faint of stomach or heart and the plot truly relates the paraells of life and the alle"
14942015,2025-08-12T11:49:32.959082+00:00,"I recommend AWAKENED enthusiastically for anyone interested in the concept of personal spiritual enlightenment, as well as for seekers who are themselves considering visiting a guru or an ashram in India. The book is a wonderfully written a"
46184553,2025-08-12T11:49:33.043256+00:00,"Ernest Thompson-Seton was the writer and illustrator of numerous famous stories of animals in the old west.  He has, in this volume, produced an invaluable reference work for anyone interested in producing accurate artistic representations"
25190172,2025-08-12T11:49:33.128033+00:00,"I cant say im a complete extrovert at this moment, but thanks to this book I have opened my eyes to a new way of thinking about communication in a most delightful way. The title describes communication as a skill, something I personally hav"
26169203,2025-08-12T11:49:33.237445+00:00,"Schizophrenics often--not always--have a sensitivity for the Unconscious and what might be going on the mind of the other as well as themselves,but few  of us ever get to \\""hear\\"" it.  In the very first three pages Laing gets into the min"
52446309,2025-08-12T11:49:33.324289+00:00,Steve McConnell has shared some invaluable insight to software developers with Code Complete. This is one of those books that every developer should read. Those who do read this book will come away with insight on developing applications sm
25085909,2025-08-12T11:49:33.409116+00:00,It isn't very difficult to point out errors in this book.  Paolini mistakes the difference between predictable and unpredictable.  He thinks that when bad things happen to a character...it's a surprise.  I'll give him credit for trying to a
49175981,2025-08-12T11:49:33.493872+00:00,"Half the book is \\""stuff\\"" I had inside but could not express or bring to life. Mike did that for me. The other half is new stuff: intensely practical (okay I'll say it) advice for guys like I. There are lots of us."
46933727,2025-08-12T11:49:33.579023+00:00,The nature cards are photographs of actual scenes. They are very colorful and depicts nature well. They are not like other flash cards that show only 1 aspect of something (sand for beach etc). There are a lot of visual information on each
12127458,2025-08-12T11:49:33.663178+00:00,"I've seen the guy skate before, both in California and up in Canada, and have been blown away by the stuff he's been able to pull off.  He lays his book out very well, showing the beginner, and the want-to-be-pro alike, exactly how to pull"
12331106,2025-08-12T11:49:33.749065+00:00,"Jim gives good basic information on how to go about planning an African safari, expanding on the information given on his website ([...] <br /> <br />The author, who has worked as a PH (Professional Hunter) in Africa for several years,  wri"
37342113,2025-08-12T11:49:33.833633+00:00,This is definitely a book that will make you question your own ability to stand up for the right thing. We all agree that the Holocaust is one of the darkest points in recent history. What's amazing (and demonstrated in this book) is that i
24657792,2025-08-12T11:49:33.918125+00:00,This is an enjoyable book written for young children at a second or third grade reading level. There are colorful pictures on every two pages that the younger children can look at.    I agree with the information on this book on the cover j
53034280,2025-08-12T11:49:34.004816+00:00,"Reading this book felt a little like watching the last episode of Cheers.  I tried to savor every last word, knowing that there would be no more.  I'm sorry we'll never learn what happens to Sir John and his court, or find out how Jeremy Pr"
12962235,2025-08-12T11:49:34.090299+00:00,i believe i read this book when i was a freshman in hs. i loved this book and it`s one of my favorites. after reading i became somewhat of a fan of francesca lia block.. my heart went out to the way she expresses the characters emotions and
52022438,2025-08-12T11:49:34.175622+00:00,"I think Magnus Lie Hetland wrote a definitive text on Python. There are many good books on Python but this one stands out. While other texts teach you HOW to do things, Hetland teaches you WHY things are being done this way and exposes the"
46118726,2025-08-12T11:49:34.260034+00:00,"oh my god, this is like watching an industrial press pump out the same thing the same thing the same thing the same thing the same thing the same thing the same thing. <br /> <br />Like most readers, loved the first 6 books. Actually the fi"
42310044,2025-08-12T11:49:34.344138+00:00,"Olympic is a beautiful park with diverse terrain, serious vertical gain, rain forests, waterfalls, northern pacific coast, glaciered peaks and miles and miles of trails for both day hikes and extensive backcountry excursions.  The falcon gu"
52921118,2025-08-12T11:49:34.431928+00:00,"Fans of the HBO series \\""Six Feet Under\\"" will recall that Lisa's niece Michaela kept trying to give this book to David, the funeral director.  I had been vaguely aware of this book when it came out 2 years ago but my interest was rekindl"
52989779,2025-08-12T11:49:34.521917+00:00,Let me be perfectly clear. <br /> <br />I have liked every other Peter David novel I have read with the exception of One Knight Only.    I couldn't get into it and gave up. <br /> <br />I think he's a great writer. <br /> <br />But if there
12429802,2025-08-12T11:49:34.607553+00:00,"One reviewer said this is captivating to the pulse and emotions.  I agree, a bit scary to imagine, waking up on a plane and not know where you are (since I'm a frequent traveler), but still captivating.  However, I prefer something more cap"
34789098,2025-08-12T11:49:34.692161+00:00,"Intriguing, fascinating... the list could go on.  \\""Blink\\"" sums up so perfectly what many of us feel, but can't put our finger on the \\""why.\\""  I was hooked from the first page, but found the final chapters even better.  It's well writ"
32377639,2025-08-12T11:49:34.779907+00:00,"This is a great book for all people, especially those who haven't had everything in life given to them on a silver platter. This book, with its uplifting and motivational stories from Rulon's life, inspires the reader to find the positive i"
50292987,2025-08-12T11:49:34.864561+00:00,"This book is a gold mine and one of the best on the market.  I would recommend this to anyone looking to shorten their learning curve.<br /><br />Lenny Laskowski, author of the book, \\""Success Via The Internet\\""<br />(...)"
40492773,2025-08-12T11:49:34.949244+00:00,"A little dated. Has some info on units that are no longer available and missing info on some of the newer units.<br /><br />But packed with tons of info on the various types of rebreathers, pre-dive, diving, emergency, and post-dive procedu"
51359604,2025-08-12T11:49:35.036106+00:00,This book is chock full of excellent references to both biblical and non-biblical texts.  The combined references make a convincing case that the Isrealite tradition was originally steeped in the early canaanite polytheism.  Smith's book wo
